{
  "schemaVersion": 1,
  "generatorVersion": "legacy-format-fixture",
  "seed": "legacy-format-fixture",
  "config": {
    "width": 32,
    "height": 32,
    "floorNumber": 1,
    "seed": "legacy-format-fixture",
    "targetRoomCount": 2,
    "minRoomSize": 3,
    "maxRoomSize": 7,
    "extraConnectionChance": 0.2
  },
  "floorNumber": 1,
  "width": 32,
  "height": 32,
  "tiles": [
    [
      "wall",
      "wall",
      "wall",
      "wall",
      "wall",
      "wall",
      "wall",
      "wall",
      "wall",
      "wall",
      "wall",
      "wall",
      "wall",
      "wall",
      "wall",
      "wall",
      "wall",
      "wall",
      "wall",
      "wall",
      "wall",
      "wall",
      "wall",
      "wall",
      "wall",
      "wall",
      "wall",
      "wall",
      "wall",
      "wall",
      "wall",
      "wall"
    ],
    [
      "wall",
      "wall",
      "wall",
      "wall",
      "wall",
      "wall",
      "wall",
      "wall",
      "wall",
      "wall",
      "wall",
      "wall",
      "wall",
      "wall",
      "wall",
      "wall",
      "wall",
      "wall",
      "wall",
      "wall",
      "wall",
      "wall",
      "wall",
      "wall",
      "wall",
      "wall",
      "wall",
      "wall",
      "wall",
      "wall",
      "wall",
      "wall"
    ],
    [
      "wall",
      "wall",
      "wall",
      "wall",
      "wall",
      "wall",
      "wall",
      "wall",
      "wall",
      "wall",
      "wall",
      "wall",
      "wall",
      "wall",
      "wall",
      "wall",
      "wall",
      "wall",
      "wall",
      "wall",
      "wall",
      "wall",
      "wall",
      "wall",
      "wall",
      "wall",
      "wall",
      "wall",
      "wall",
      "wall",
      "wall",
      "wall"
    ],
    [
      "wall",
      "wall",
      "wall",
      "wall",
      "wall",
      "floor",
      "floor",
      "floor",
      "floor",
      "floor",
      "wall",
      "wall",
      "wall",
      "wall",
      "wall",
      "wall",
      "wall",
      "wall",
      "wall",
      "wall",
      "wall",
      "wall",
      "wall",
      "wall",
      "wall",
      "wall",
      "wall",
      "wall",
      "wall",
      "wall",
      "wall",
      "wall"
    ],
    [
      "wall",
      "wall",
      "wall",
      "wall",
      "wall",
      "floor",
      "floor",
      "floor",
      "floor",
      "floor",
      "wall",
      "wall",
      "wall",
      "wall",
      "wall",
      "wall",
      "wall",
      "wall",
      "wall",
      "wall",
      "wall",
      "wall",
      "wall",
      "wall",
      "wall",
      "wall",
      "wall",
      "wall",
      "wall",
      "wall",
      "wall",
      "wall"
    ],
    [
      "wall",
      "wall",
      "wall",
      "wall",
      "wall",
      "floor",
      "floor",
      "floor",
      "floor",
      "floor",
      "wall",
      "wall",
      "wall",
      "wall",
      "wall",
      "wall",
      "wall",
      "wall",
      "wall",
      "wall",
      "wall",
      "wall",
      "wall",
      "wall",
      "wall",
      "wall",
      "wall",
      "wall",
      "wall",
      "wall",
      "wall",
      "wall"
    ],
    [
      "wall",
      "wall",
      "wall",
      "wall",
      "wall",
      "floor",
      "floor",
      "floor",
      "floor",
      "floor",
      "wall",
      "wall",
      "wall",
      "wall",
      "wall",
      "wall",
      "wall",
      "wall",
      "wall",
      "wall",
      "wall",
      "wall",
      "wall",
      "wall",
      "wall",
      "wall",
      "wall",
      "wall",
      "wall",
      "wall",
      "wall",
      "wall"
    ],
    [
      "wall",
      "wall",
      "wall",
      "wall",
      "wall",
      "floor",
      "floor",
      "floor",
      "floor",
      "floor",
      "wall",
      "wall",
      "wall",
      "wall",
      "wall",
      "wall",
      "wall",
      "wall",
      "wall",
      "wall",
      "wall",
      "wall",
      "wall",
      "wall",
      "wall",
      "wall",
      "wall",
      "wall",
      "wall",
      "wall",
      "wall",
      "wall"
    ],
    [
      "wall",
      "wall",
      "wall",
      "wall",
      "wall",
      "floor",
      "floor",
      "floor",
      "floor",
      "floor",
      "door",
      "floor",
      "floor",
      "floor",
      "wall",
      "wall",
      "wall",
      "wall",
      "wall",
      "wall",
      "wall",
      "wall",
      "wall",
      "wall",
      "wall",
      "wall",
      "wall",
      "wall",
      "wall",
      "wall",
      "wall",
      "wall"
    ],
    [
      "wall",
      "wall",
      "wall",
      "wall",
      "wall",
      "wall",
      "wall",
      "wall",
      "wall",
      "wall",
      "wall",
      "wall",
      "wall",
      "floor",
      "wall",
      "wall",
      "wall",
      "wall",
      "wall",
      "wall",
      "wall",
      "wall",
      "wall",
      "wall",
      "wall",
      "wall",
      "wall",
      "wall",
      "wall",
      "wall",
      "wall",
      "wall"
    ],
    [
      "wall",
      "wall",
      "wall",
      "wall",
      "wall",
      "wall",
      "wall",
      "wall",
      "wall",
      "wall",
      "wall",
      "wall",
      "wall",
      "door",
      "wall",
      "wall",
      "wall",
      "wall",
      "wall",
      "wall",
      "wall",
      "wall",
      "wall",
      "wall",
      "wall",
      "wall",
      "wall",
      "wall",
      "wall",
      "wall",
      "wall",
      "wall"
    ],
    [
      "wall",
      "wall",
      "wall",
      "wall",
      "wall",
      "wall",
      "wall",
      "wall",
      "wall",
      "wall",
      "wall",
      "wall",
      "wall",
      "floor",
      "floor",
      "floor",
      "wall",
      "wall",
      "wall",
      "wall",
      "wall",
      "wall",
      "wall",
      "wall",
      "wall",
      "wall",
      "wall",
      "wall",
      "wall",
      "wall",
      "wall",
      "wall"
    ],
    [
      "wall",
      "wall",
      "wall",
      "wall",
      "wall",
      "wall",
      "wall",
      "wall",
      "wall",
      "wall",
      "wall",
      "wall",
      "wall",
      "floor",
      "floor",
      "floor",
      "wall",
      "wall",
      "wall",
      "wall",
      "wall",
      "wall",
      "wall",
      "wall",
      "wall",
      "wall",
      "wall",
      "wall",
      "wall",
      "wall",
      "wall",
      "wall"
    ],
    [
      "wall",
      "wall",
      "wall",
      "wall",
      "wall",
      "wall",
      "wall",
      "wall",
      "wall",
      "wall",
      "wall",
      "wall",
      "wall",
      "floor",
      "floor",
      "floor",
      "wall",
      "wall",
      "wall",
      "wall",
      "wall",
      "wall",
      "wall",
      "wall",
      "wall",
      "wall",
      "wall",
      "wall",
      "wall",
      "wall",
      "wall",
      "wall"
    ],
    [
      "wall",
      "wall",
      "wall",
      "wall",
      "wall",
      "wall",
      "wall",
      "wall",
      "wall",
      "wall",
      "wall",
      "wall",
      "wall",
      "floor",
      "floor",
      "floor",
      "wall",
      "wall",
      "wall",
      "wall",
      "wall",
      "wall",
      "wall",
      "wall",
      "wall",
      "wall",
      "wall",
      "wall",
      "wall",
      "wall",
      "wall",
      "wall"
    ],
    [
      "wall",
      "wall",
      "wall",
      "wall",
      "wall",
      "wall",
      "wall",
      "wall",
      "wall",
      "wall",
      "wall",
      "wall",
      "wall",
      "floor",
      "floor",
      "floor",
      "wall",
      "wall",
      "wall",
      "wall",
      "wall",
      "wall",
      "wall",
      "wall",
      "wall",
      "wall",
      "wall",
      "wall",
      "wall",
      "wall",
      "wall",
      "wall"
    ],
    [
      "wall",
      "wall",
      "wall",
      "wall",
      "wall",
      "wall",
      "wall",
      "wall",
      "wall",
      "wall",
      "wall",
      "wall",
      "wall",
      "wall",
      "wall",
      "wall",
      "wall",
      "wall",
      "wall",
      "wall",
      "wall",
      "wall",
      "wall",
      "wall",
      "wall",
      "wall",
      "wall",
      "wall",
      "wall",
      "wall",
      "wall",
      "wall"
    ],
    [
      "wall",
      "wall",
      "wall",
      "wall",
      "wall",
      "wall",
      "wall",
      "wall",
      "wall",
      "wall",
      "wall",
      "wall",
      "wall",
      "wall",
      "wall",
      "wall",
      "wall",
      "wall",
      "wall",
      "wall",
      "wall",
      "wall",
      "wall",
      "wall",
      "wall",
      "wall",
      "wall",
      "wall",
      "wall",
      "wall",
      "wall",
      "wall"
    ],
    [
      "wall",
      "wall",
      "wall",
      "wall",
      "wall",
      "wall",
      "wall",
      "wall",
      "wall",
      "wall",
      "wall",
      "wall",
      "wall",
      "wall",
      "wall",
      "wall",
      "wall",
      "wall",
      "wall",
      "wall",
      "wall",
      "wall",
      "wall",
      "wall",
      "wall",
      "wall",
      "wall",
      "wall",
      "wall",
      "wall",
      "wall",
      "wall"
    ],
    [
      "wall",
      "wall",
      "wall",
      "wall",
      "wall",
      "wall",
      "wall",
      "wall",
      "wall",
      "wall",
      "wall",
      "wall",
      "wall",
      "wall",
      "wall",
      "wall",
      "wall",
      "wall",
      "wall",
      "wall",
      "wall",
      "wall",
      "wall",
      "wall",
      "wall",
      "wall",
      "wall",
      "wall",
      "wall",
      "wall",
      "wall",
      "wall"
    ],
    [
      "wall",
      "wall",
      "wall",
      "wall",
      "wall",
      "wall",
      "wall",
      "wall",
      "wall",
      "wall",
      "wall",
      "wall",
      "wall",
      "wall",
      "wall",
      "wall",
      "wall",
      "wall",
      "wall",
      "wall",
      "wall",
      "wall",
      "wall",
      "wall",
      "wall",